name,username,userId,can_dm,created_at,bio,tweets_count,followers_count,following_count,favourites_count,location,media_count,profile_banner_url,profile_url,avatar_url,verified,blue_verified
President Biden,POTUS,'1349149096909668363',false,2021-01-12 19:37:08,"46th President of the United States, husband to @FLOTUS, proud dad & pop. Tweets may be archived: https://t.co/HDhBZBkKpU Text me: (302) 404-0880",8709,34831306,5,18,,3357,https://pbs.twimg.com/profile_banners/1349149096909668363/1712150452,https://www.twitter.com/POTUS,https://pbs.twimg.com/profile_images/1380530524779859970/TfwVAbyX_normal.jpg,false,true
The White House,WhiteHouse,'1323730225067339784',false,2020-11-03 15:55:58,Welcome to the Biden-Harris White House! Tweets may be archived: https://t.co/UbZQo0sWVf,9207,8840784,6,44,United States of America,3793,https://pbs.twimg.com/profile_banners/1323730225067339784/1712157667,https://www.twitter.com/WhiteHouse,https://pbs.twimg.com/profile_images/1351938473142448133/JQT93Cjo_normal.jpg,false,true
Pete Buttigieg,PeteButtigieg,'226222147',false,2010-12-13 11:49:04,"Personal account. For official updates, follow @SecretaryPete. Husband, father, veteran, writer, South Bend’s former Mayor Pete. (he/him)",13299,3697457,2803,1842,"Traverse City, MI",2569,https://pbs.twimg.com/profile_banners/226222147/1612363715,https://www.twitter.com/PeteButtigieg,https://pbs.twimg.com/profile_images/1296843982740361217/EaG1ATqj_normal.jpg,false,true
Doug Emhoff,DouglasEmhoff,'260759782',false,2011-03-04 09:56:34,Devoted dad. Proud husband to @KamalaHarris. Advocate for justice and equality. Official account is @SecondGentleman.,4306,986251,895,621,,839,https://pbs.twimg.com/profile_banners/260759782/1682419158,https://www.twitter.com/DouglasEmhoff,https://pbs.twimg.com/profile_images/1356257880517844994/1hNgzDBm_normal.jpg,false,true
DNC War Room,DNCWarRoom,'4486093643',true,2015-12-14 18:34:33,Rapid response for @TheDemocrats.,14517,94535,100,122,"Washington, D.C.",4960,https://pbs.twimg.com/profile_banners/4486093643/1698420639,https://www.twitter.com/DNCWarRoom,https://pbs.twimg.com/profile_images/1717926786263113728/aNHsKZqk_normal.png,false,false
chrissy teigen,chrissyteigen,'39364684',false,2009-05-11 18:50:04,de-motivational speaker,15941,12511229,4646,35868,couch,2210,https://pbs.twimg.com/profile_banners/39364684/1607474821,https://www.twitter.com/chrissyteigen,https://pbs.twimg.com/profile_images/1243351734757425152/e8JZwf03_normal.jpg,false,true
Dr. Miguel A. Cardona,teachcardona,'763766437',false,2012-08-17 09:56:53,"Husband, Father of 2, Secretary of Education, follow official account @SecCardona",603,74264,295,1948,,182,https://pbs.twimg.com/profile_banners/763766437/1608860180,https://www.twitter.com/teachcardona,https://pbs.twimg.com/profile_images/1205529274754703362/wa_k1af9_normal.jpg,false,false
Alejandro Mayorkas,AliMayorkas,'1330873099424854017',false,2020-11-23 08:57:45,"Former DHS Deputy Secretary, Dad, Husband, Immigrant, Fortunate | Secretary of Homeland Security Nominee for @JoeBiden",11,173528,10,0,United States,2,https://pbs.twimg.com/profile_banners/1330873099424854017/1606153745,https://www.twitter.com/AliMayorkas,https://pbs.twimg.com/profile_images/1330930121331650562/Gaoy_0LD_normal.jpg,false,true
Antony Blinken,ABlinken,'635716830',false,2012-07-14 16:29:35,My personal account. For our work at the State Department please follow @SecBlinken.,2070,406820,915,1781,"Washington, DC",307,https://pbs.twimg.com/profile_banners/635716830/1442934446,https://www.twitter.com/ABlinken,https://pbs.twimg.com/profile_images/646067499943989248/oqBSDthR_normal.jpg,false,false
Secretary Janet Yellen,SecYellen,'1333171793201225728',false,2020-11-29 17:12:26,78th Secretary of the Treasury. Former Fed Chair. Always an economist.,1232,386839,79,2,,418,https://pbs.twimg.com/profile_banners/1333171793201225728/1653500820,https://www.twitter.com/SecYellen,https://pbs.twimg.com/profile_images/1333421043772375043/N3Z22RJ1_normal.jpg,false,false
Neera Tanden🌻,neeratanden,'125453969',false,2010-03-22 17:47:49,"Personal account. Liberal, Indian American, feminist, mom, wife. Not in that order. Banned by Russia and proud of it. Views expressed are most definitely my own",88602,364474,1409,32789,DC,406,https://pbs.twimg.com/profile_banners/125453969/1610250273,https://www.twitter.com/neeratanden,https://pbs.twimg.com/profile_images/1591811328368414721/tQJtAP1g_normal.jpg,false,true
Xavier Becerra,XavierBecerra,'565469671',false,2012-04-28 10:05:56,"Fighter for underserved communities, health care, and justice. This is my personal account. For official updates, follow @SecBecerra.",3689,54234,2220,2697,"Sacramento, CA",585,https://pbs.twimg.com/profile_banners/565469671/1607352014,https://www.twitter.com/XavierBecerra,https://pbs.twimg.com/profile_images/1335957285953175552/-rk0sWjs_normal.jpg,false,false
Marcia L. Fudge,mlfudge,'18829123',false,2009-01-10 01:56:46,HUD Secretary. Advocate for justice.,408,33476,1595,54,Ohio,23,https://pbs.twimg.com/profile_banners/18829123/1607616965,https://www.twitter.com/mlfudge,https://pbs.twimg.com/profile_images/1118154176255623168/2zeYt07X_normal.png,false,false
Denis McDonough,DenisMcDonough,'820830366713991168',false,2017-01-15 22:09:44,Dad. Retired coach. Proud Minnesotan. VA Secretary Nominee. Ready.,70,41892,268,38,"Washington, DC",5,https://pbs.twimg.com/profile_banners/820830366713991168/1484698899,https://www.twitter.com/DenisMcDonough,https://pbs.twimg.com/profile_images/821512182709878786/B91NX0cF_normal.jpg,false,false
Deb Haaland,DebHaalandNM,'286476728',false,2011-04-22 22:39:36,"Personal account. For official updates, follow @SecDebHaaland. Proud 35th Generation New Mexican. Former #NM1 Rep. Proud UNM Lobo mom. Pueblo woman. She/her",13567,245189,2124,18653,Albuquerque,2016,https://pbs.twimg.com/profile_banners/286476728/1608233700,https://www.twitter.com/DebHaalandNM,https://pbs.twimg.com/profile_images/1312054601013633025/9uYqTojl_normal.jpg,false,false
Jennifer Granholm,JenGranholm,'14185317',false,2008-03-20 12:55:16,This is my personal feed; please follow at @SecGranholm where I will be most often. Former Gov. of MI; advocate for clean energy & US jobs. I block trolls.,25620,154434,11956,10295,"Washington, DC",558,https://pbs.twimg.com/profile_banners/14185317/1389204493,https://www.twitter.com/JenGranholm,https://pbs.twimg.com/profile_images/1341488484603727872/1wgZZTri_normal.jpg,false,false
Secretary of Defense Lloyd J. Austin III,SecDef,'1338994562090602497',false,2020-12-15 18:49:21,28th United States Secretary of Defense,4356,673306,203,136,The Pentagon,1261,https://pbs.twimg.com/profile_banners/1338994562090602497/1661475113,https://www.twitter.com/SecDef,https://pbs.twimg.com/profile_images/1691879598294712320/_TY54bb4_normal.jpg,false,true
Biden Inaugural Committee,BidenInaugural,'1333168873860984832',false,2020-11-29 17:00:08,Thank you for joining us for the historic inauguration of @POTUS and @VP. A new chapter has begun. #Inauguration2021,328,248341,5,69,,167,https://pbs.twimg.com/profile_banners/1333168873860984832/1606695557,https://www.twitter.com/BidenInaugural,https://pbs.twimg.com/profile_images/1333198559089405953/T3RhkQz7_normal.jpg,false,false
Biden-Harris HQ,BidenHQ,'3315264553',true,2015-08-14 12:21:06,"Just the facts, Jack. 

We’re on the other website, too: https://t.co/9Z2jW1VQ7a",4285,333732,4,0,,3595,https://pbs.twimg.com/profile_banners/3315264553/1712158183,https://www.twitter.com/BidenHQ,https://pbs.twimg.com/profile_images/1706852205892960256/tk1C73_B_normal.png,false,true
Kamala Harris,KamalaHarris,'30354991',false,2009-04-10 20:42:07,"Fighting for the people. Wife, Momala, Auntie. She/her. Official account is @VP.",18434,19815929,723,364,"Washington, DC",4055,https://pbs.twimg.com/profile_banners/30354991/1682445235,https://www.twitter.com/KamalaHarris,https://pbs.twimg.com/profile_images/1592241313700782081/T2pTYU8d_normal.jpg,false,true
Joe for Nevada,JoeForNV,'1141928541656952832',false,2019-06-21 00:39:15,The official account for our grassroots team working to elect @JoeBiden in Nevada. Text JOE to 30330 to get involved and join @TeamJoe!,3026,12128,867,4851,Nevada,612,https://pbs.twimg.com/profile_banners/1141928541656952832/1596463253,https://www.twitter.com/JoeForNV,https://pbs.twimg.com/profile_images/1157459791381331968/wdPfMRsC_normal.jpg,false,false
Joe Won.,JoeForSC,'1141929375639777280',false,2019-06-21 00:42:33,Organizing and mobilizing the Palmetto State for @JoeBiden 🌴 | Text SC to 30330 for updates,640,9134,199,215,"Columbia, SC",239,https://pbs.twimg.com/profile_banners/1141929375639777280/1581692016,https://www.twitter.com/JoeForSC,https://pbs.twimg.com/profile_images/1162388438198489088/ajbU-t1r_normal.png,false,false
Joe For New Hampshire,JoeForNH,'1141929016443777024',false,2019-06-21 00:41:08,"Official New Hampshire page for #TeamJoe. Follow for all things Joe, Granite State, and ice cream-related. Text NH to 30330 to get involved!",1566,10841,6,134,,415,https://pbs.twimg.com/profile_banners/1141929016443777024/1581106896,https://www.twitter.com/JoeForNH,https://pbs.twimg.com/profile_images/1149042037934755846/GjQ9mnE3_normal.jpg,false,false
Joe for Iowa,JoeForIA,'1141928177046106114',false,2019-06-21 00:37:48,The official Iowa page for #TeamJoe. Text POLLS to 30330 to find your polling location!,1223,9488,97,1207,"Iowa, USA",409,https://pbs.twimg.com/profile_banners/1141928177046106114/1602191509,https://www.twitter.com/JoeForIA,https://pbs.twimg.com/profile_images/1314306448122413056/JKXH93Di_normal.jpg,false,false
Team Joe,TeamJoe,'1129095209772552192',true,2019-05-16 14:44:10,A grassroots campaign to reelect @JoeBiden and @KamalaHarris. Go to https://t.co/gHbXmzWhRM to get on board. Account managed by #TeamJoe staff.,6616,187065,936,1101,,827,https://pbs.twimg.com/profile_banners/1129095209772552192/1682418753,https://www.twitter.com/TeamJoe,https://pbs.twimg.com/profile_images/1650810013756080128/_7vgAOBK_normal.jpg,false,false
Elena Delle Donne,De11eDonne,'609476852',false,2012-06-15 18:17:17,Washington Mystics #11 Delaware Native,5504,263467,686,6825,,756,https://pbs.twimg.com/profile_banners/609476852/1471808208,https://www.twitter.com/De11eDonne,https://pbs.twimg.com/profile_images/1519633531676282885/6YFmtMmd_normal.jpg,false,false
Lady Gaga,ladygaga,'14230524',false,2008-03-26 18:37:48,JAZZ & PIANO 🎺🎼 JUNE 19 - JULY 6 | HAUS LABS 💄 @hauslabs | THE CHROMATICA BALL ⚔️💓 | JOKER: FOLIE À DEUX 🃏 OCTOBER 4,9956,83395318,112446,2922,,2006,https://pbs.twimg.com/profile_banners/14230524/1690808625,https://www.twitter.com/ladygaga,https://pbs.twimg.com/profile_images/1548557958564364289/6ewE00_O_normal.jpg,false,true
It's On Us,ItsOnUs,'2840712124',true,2014-10-21 17:24:07,Changing the culture around campus sexual assault. #ItsOnUs,11481,33867,1224,6974,United States,1866,https://pbs.twimg.com/profile_banners/2840712124/1713204952,https://www.twitter.com/ItsOnUs,https://pbs.twimg.com/profile_images/1779936692545171457/VwGK1ICJ_normal.jpg,false,false
Dr. Jill Biden,DrBiden,'821784477076750338',true,2017-01-18 13:21:02,Lifelong educator. Military mother. Grandmother. Sister. Wife to @JoeBiden.,963,3641607,26,413,,365,https://pbs.twimg.com/profile_banners/821784477076750338/1682426132,https://www.twitter.com/DrBiden,https://pbs.twimg.com/profile_images/1334146854414667777/P1NgFO9L_normal.jpg,false,true
Biden Institute,UDBidenInst,'869995492687716354',false,2017-05-31 15:14:24,"The Biden Institute works to tackle our nation's most pressing domestic issues while promoting economic justice, social justice, and civic responsibility.",1141,29950,88,527,"Newark, DE",658,https://pbs.twimg.com/profile_banners/869995492687716354/1503513700,https://www.twitter.com/UDBidenInst,https://pbs.twimg.com/profile_images/909775558543904769/VpuPXov__normal.jpg,false,false
Biden Cancer,BidenCancer,'861976361853964288',false,2017-05-09 12:09:14,"Accelerating progress in #cancer prevention, detection, diagnosis, research and care through collaboration.",888,22892,124,871,"Washington, DC",189,https://pbs.twimg.com/profile_banners/861976361853964288/1537498141,https://www.twitter.com/BidenCancer,https://pbs.twimg.com/profile_images/1120783776928403456/vnvqAGgP_normal.png,false,false
Penn Biden Center,PennBiden,'831600619332968449',false,2017-02-14 15:26:52,"The @Penn Biden Center for Diplomacy and Global Engagement believes that a democratic, open, secure, tolerant, and interconnected world benefits all Americans.",1553,24406,35,143,"Washington, DC",267,https://pbs.twimg.com/profile_banners/831600619332968449/1490199374,https://www.twitter.com/PennBiden,https://pbs.twimg.com/profile_images/940974107792875520/7E4xCf50_normal.jpg,false,false
The Obama Foundation,ObamaFoundation,'2293315159',false,2014-01-15 15:02:36,"Our mission is to inspire people to take action, empower them to change their world for the better, and connect them so they can achieve more together.",3377,1101988,89,966,,1734,https://pbs.twimg.com/profile_banners/2293315159/1572892194,https://www.twitter.com/ObamaFoundation,https://pbs.twimg.com/profile_images/1213134508964425728/D2ZX7SLU_normal.jpg,false,true
Livelihood,livelihood2017,'823885566232109057',false,2017-01-24 08:30:00,#KeepYourHoodUp,50,7965,50,162,"Delaware, USA",2,https://pbs.twimg.com/profile_banners/823885566232109057/1487033183,https://www.twitter.com/livelihood2017,https://pbs.twimg.com/profile_images/831301432376688640/dCfpTpZF_normal.jpg,false,false
Biden Foundation,bidenfoundation,'4636121783',false,2015-12-28 16:10:41,"Effective April 25, 2019, the Biden Foundation suspended operations.",1023,94662,24,202,,208,https://pbs.twimg.com/profile_banners/4636121783/1498491255,https://www.twitter.com/bidenfoundation,https://pbs.twimg.com/profile_images/888436476316233729/bjzVzVgz_normal.jpg,false,false
Tim Kaine,timkaine,'172858784',false,2010-07-30 16:00:32,"Anne Holton’s husband, Dad of 3, Stone Irish, public servant, musician, civil rights lawyer, backpacker.
 
Text (804) 587-7004 to join our campaign.",12601,938136,779,893,"Richmond, VA",2200,https://pbs.twimg.com/profile_banners/172858784/1703168932,https://www.twitter.com/timkaine,https://pbs.twimg.com/profile_images/1772632114657173505/fxIJLQcK_normal.jpg,false,false
Hillary Clinton,HillaryClinton,'1339835893',false,2013-04-09 14:04:35,"2016 Democratic Nominee, SecState, Senator, hair icon. Mom, Wife, Grandma x3, lawyer, advocate, fan of walks in the woods & standing up for our democracy.",14337,31144412,996,1177,"New York, NY",3970,https://pbs.twimg.com/profile_banners/1339835893/1539631689,https://www.twitter.com/HillaryClinton,https://pbs.twimg.com/profile_images/1291192333199958017/SvH8J8_P_normal.jpg,false,true
Dr. Biden -Archived,DrBiden44,'1281405877',false,2013-03-19 16:08:31,This is an archive of an Obama Administration account maintained by the National Archives and Records Administration (NARA).,1628,187937,395,64,"Washington, DC",320,https://pbs.twimg.com/profile_banners/1281405877/1432320875,https://www.twitter.com/DrBiden44,https://pbs.twimg.com/profile_images/608687663034474496/wvzVG_yt_normal.jpg,false,false
The White House 45 Archived,WhiteHouse45,'822215673812119553',false,2017-01-19 17:54:27,"This is an archive of a Trump Administration account, maintained by the National Archives and Records Administration.",24047,24260277,12,19,"Washington, D.C.",8422,https://pbs.twimg.com/profile_banners/822215673812119553/1603063964,https://www.twitter.com/WhiteHouse45,https://pbs.twimg.com/profile_images/1059888693945630720/yex0Gcbi_normal.jpg,false,true
White House Archived,ObamaWhiteHouse,'30313925',false,2009-04-10 17:10:30,This is an archive of an Obama Administration account maintained by the National Archives and Records Administration (NARA).,28177,11673877,225,0,"Washington, DC",7147,https://pbs.twimg.com/profile_banners/30313925/1484883412,https://www.twitter.com/ObamaWhiteHouse,https://pbs.twimg.com/profile_images/747463206759698432/c8cVVWhj_normal.jpg,false,true
Vice President Mike Pence Archived,VP45,'818910970567344128',false,2017-01-10 15:02:44,"This is an archive of a Trump Administration account, maintained by the National Archives and Records Administration.",9370,9474363,15,19,"Washington, D.C.",3511,https://pbs.twimg.com/profile_banners/818910970567344128/1580944734,https://www.twitter.com/VP45,https://pbs.twimg.com/profile_images/951600999902281728/s-3S8iBE_normal.jpg,false,true
VP Biden (Archived),VP44,'325830217',false,2011-06-28 19:07:42,This is an archive of an Obama Administration account maintained by the National Archives and Records Administration (NARA).,3643,2276545,128,11,"Washington, D.C.",1137,https://pbs.twimg.com/profile_banners/325830217/1464973756,https://www.twitter.com/VP44,https://pbs.twimg.com/profile_images/464835807837044737/vO0cnKR1_normal.jpeg,false,true
Beau Biden Foundation,BeauBidenFdn,'142894598',false,2010-05-11 21:27:36,"501(c)(3) nonprofit organization honoring Beau Biden's life's work to protect children and confront abuse.
https://t.co/m1MXV35YHk…",2633,43940,323,246,Delaware,865,https://pbs.twimg.com/profile_banners/142894598/1692629820,https://www.twitter.com/BeauBidenFdn,https://pbs.twimg.com/profile_images/1166078592880697346/c9OZZ1-j_normal.jpg,false,false
The Democrats,TheDemocrats,'14377605',true,2008-04-13 16:23:13,"We’re fighting for a better, fairer, and brighter future for every American.",43470,2380308,77,1297,"Washington, D.C.",12881,https://pbs.twimg.com/profile_banners/14377605/1689609214,https://www.twitter.com/TheDemocrats,https://pbs.twimg.com/profile_images/1535252901970317315/FrdN7_ry_normal.jpg,false,true
Michelle Obama,MichelleObama,'409486555',false,2011-11-10 15:13:01,"Girl from the South Side and former First Lady. Wife, mother, dog lover. Always hugger-in-chief. #TheLightWeCarry",2388,22077111,18,308,"Washington, DC",760,https://pbs.twimg.com/profile_banners/409486555/1713271088,https://www.twitter.com/MichelleObama,https://pbs.twimg.com/profile_images/1762836277567631360/wECMw3TT_normal.jpg,false,true
Barack Obama,BarackObama,'813286',false,2007-03-05 17:08:25,"Dad, husband, President, citizen.",17016,131870745,542985,10,"Washington, DC",2626,https://pbs.twimg.com/profile_banners/813286/1712782825,https://www.twitter.com/BarackObama,https://pbs.twimg.com/profile_images/1329647526807543809/2SGvnHYV_normal.jpg,false,true
